{"generado_en": "2026-07-10T18:44:21Z", "version": {"git_commit": "af07bc9"}, "banderas": [{"id": "F01", "nombre": "Único oferente", "nivel": "contract", "peso": 15, "descripcion": "En procesos de modalidad competitiva (licitación pública, selección abreviada o concurso de méritos) -- abiertos en principio a cualquier proponente -- se presentó o fue habilitado un único oferente. La competencia fue solo nominal."}, {"id": "F02", "nombre": "Empresa exprés", "nivel": "contract", "peso": 15, "descripcion": "El proveedor ganador se registró en el registro mercantil (RUES) menos de 90 días antes de la publicación del proceso: un patrón típico de 'empresa de papel' creada para ganar un contrato puntual."}, {"id": "F03", "nombre": "Adiciones excesivas", "nivel": "contract", "peso": 12, "descripcion": "Después de adjudicado, el contrato fue modificado con adiciones de valor (40% o más del valor inicial) o de plazo (días adicionados igual o mayor al 50% de la duración inicial) -- la forma más documentada de inflar un contrato ya otorgado, sin nueva competencia."}, {"id": "F04", "nombre": "Abuso de contratación directa", "nivel": "entity", "peso": 8, "descripcion": "La entidad contrata de forma directa (sin proceso competitivo) muchísimo más que entidades comparables de su mismo departamento y nivel (2 o más desviaciones estándar por encima del grupo de pares)."}, {"id": "F05", "nombre": "Fraccionamiento", "nivel": "contract", "peso": 12, "descripcion": "La misma entidad firmó 3 o más contratos directos con el mismo proveedor, en la misma categoría de bienes/servicios, dentro de una ventana de 90 días, sumando más de 280 salarios mínimos -- un patrón para evadir el umbral que obligaría a licitar."}, {"id": "F06", "nombre": "Carrusel", "nivel": "contract", "peso": 12, "descripcion": "Dentro de una misma entidad (o municipio y categoría), un grupo pequeño de 2 a 4 proveedores se reparte y alterna sistemáticamente la mayoría de los contratos competitivos en una ventana de 24 meses -- un patrón de reparto acordado del mercado."}, {"id": "F07", "nombre": "Ventana de licitación corta", "nivel": "contract", "peso": 8, "descripcion": "El tiempo entre la publicación del proceso y el cierre para recibir ofertas fue menor al mínimo reglamentario según la modalidad (10 días hábiles en licitación pública, 5 en selección abreviada) -- limita quién alcanza a enterarse y presentar oferta."}, {"id": "F08", "nombre": "Precio calcado", "nivel": "contract", "peso": 6, "descripcion": "El valor adjudicado quedó dentro de un margen de ±0,5% frente al precio base publicado por la entidad -- indicio de que el proponente ganador conocía de antemano el presupuesto oficial."}, {"id": "F09", "nombre": "Afán de diciembre", "nivel": "contract", "peso": 8, "descripcion": "El contrato se firmó entre el 15 y el 31 de diciembre, en el cierre de la vigencia fiscal, una ventana con menor escrutinio público y mediático."}, {"id": "F10", "nombre": "Ventana electoral", "nivel": "contract", "peso": 6, "descripcion": "Contrato adjudicado de forma directa dentro de los períodos restringidos por la Ley de Garantías Electorales, cuando la contratación pública está sujeta a mayores límites precisamente para evitar su uso político."}, {"id": "F11", "nombre": "Proveedor sancionado", "nivel": "contract", "peso": 20, "descripcion": "El proveedor tiene una sanción registrada (responsabilidad fiscal de la Contraloría, multas contractuales en SECOP, o antecedentes disciplinarios de la Procuraduría) con fecha anterior a la firma de este contrato -- la única bandera basada en un historial confirmado, no solo en un patrón estadístico; por eso tiene el mayor peso del catálogo."}, {"id": "F12", "nombre": "Concentración/dependencia", "nivel": "entity", "peso": 8, "descripcion": "Un mismo proveedor concentra más del 50% del valor que la entidad contrató ese año, o ese proveedor depende de esa única entidad para más del 80% de sus ingresos por contratación pública -- señal de una relación cerrada entre las dos partes."}, {"id": "F13", "nombre": "Objeto vago", "nivel": "contract", "peso": 3, "descripcion": "El objeto del contrato tiene menos de 40 caracteres, o es un texto genérico que se repite en un número inusualmente alto de contratos -- dificulta saber, a partir del documento público, qué se contrató realmente."}, {"id": "F14", "nombre": "Valor redondo", "nivel": "contract", "peso": 2, "descripcion": "El valor del contrato es de al menos 1.000 millones de pesos y, además, es un múltiplo exacto de 100 millones -- un indicio débil (por eso el peso mínimo del catálogo) de que la cifra no vino de un presupuesto detallado sino de una aproximación."}], "niveles_riesgo": [{"id": "bajo", "nombre": "Bajo", "min_score": 0, "max_score": 20}, {"id": "medio", "nombre": "Medio", "min_score": 20, "max_score": 40}, {"id": "alto", "nombre": "Alto", "min_score": 40, "max_score": 60}, {"id": "critico", "nombre": "Crítico", "min_score": 60, "max_score": null}], "formula_score": "100 x (suma de pesos de banderas disparadas) / (suma de pesos de banderas aplicables)", "shrinkage": {"k": 10.0, "min_contratos_rank": 10}, "backtest": {"auc_roc": 0.33695652173913043, "objetivo_auc_roc": 0.6, "lift_top_decil": 0.0, "objetivo_lift_top_decil": 1.5, "cumple_objetivos": false, "n_contratos_evaluados": 50, "n_positivos_l1_l4": 4, "precision_top_1pct": 0.0, "precision_top_5pct": 0.0, "precision_top_10pct": 0.0, "casos_emblematicos": [{"slug": "centros-poblados", "nombre": "Contrato Centros Poblados — MinTIC", "periodo": [2020, 2021], "n_matched": 0, "mejor_score": null, "mejor_tier": null, "percentil_anio": null, "cuartil_superior": null, "confirmado_manualmente": false}, {"slug": "ungrd-carrotanques", "nombre": "UNGRD — Carrotanques La Guajira 2023–2024", "periodo": [2023, 2024], "n_matched": 0, "mejor_score": null, "mejor_tier": null, "percentil_anio": null, "cuartil_superior": null, "confirmado_manualmente": false}, {"slug": "pae-la-guajira", "nombre": "PAE La Guajira — Programa de Alimentación Escolar 2016–2018", "periodo": [2016, 2018], "n_matched": 0, "mejor_score": null, "mejor_tier": null, "percentil_anio": null, "cuartil_superior": null, "confirmado_manualmente": false}, {"slug": "pae-santander", "nombre": "PAE Santander — Programa de Alimentación Escolar", "periodo": [2016, 2020], "n_matched": 0, "mejor_score": null, "mejor_tier": null, "percentil_anio": null, "cuartil_superior": null, "confirmado_manualmente": false}, {"slug": "ruta-del-sol-odebrecht", "nombre": "Ruta del Sol II — Odebrecht / Corficolombiana (ANI/INCO)", "periodo": [2010, 2016], "n_matched": 0, "mejor_score": null, "mejor_tier": null, "percentil_anio": null, "cuartil_superior": null, "confirmado_manualmente": false}, {"slug": "carrusel-contratacion-idu", "nombre": "Carrusel de la Contratación — IDU Bogotá 2008–2012", "periodo": [2008, 2012], "n_matched": 0, "mejor_score": null, "mejor_tier": null, "percentil_anio": null, "cuartil_superior": null, "confirmado_manualmente": false}, {"slug": "cartel-hemofilia-cordoba", "nombre": "Cartel de la Hemofilia — Córdoba 2013–2015", "periodo": [2013, 2015], "n_matched": 0, "mejor_score": null, "mejor_tier": null, "percentil_anio": null, "cuartil_superior": null, "confirmado_manualmente": false}, {"slug": "cartel-sida-cordoba", "nombre": "Cartel del SIDA — Córdoba", "periodo": [2011, 2015], "n_matched": 0, "mejor_score": null, "mejor_tier": null, "percentil_anio": null, "cuartil_superior": null, "confirmado_manualmente": false}, {"slug": "sobrecostos-covid-bogota", "nombre": "Sobrecostos COVID-19 — Bogotá 2020", "periodo": [2020, 2020], "n_matched": 0, "mejor_score": null, "mejor_tier": null, "percentil_anio": null, "cuartil_superior": null, "confirmado_manualmente": false}, {"slug": "sobrecostos-covid-medellin", "nombre": "Sobrecostos COVID-19 — Medellín 2020", "periodo": [2020, 2020], "n_matched": 0, "mejor_score": null, "mejor_tier": null, "percentil_anio": null, "cuartil_superior": null, "confirmado_manualmente": false}], "n_casos_emblematicos_total": 10, "n_casos_emblematicos_con_coincidencias_genuinas": 0, "n_casos_emblematicos_en_percentil_superior": 0, "monitor_ciudadano": {"n_total": 3, "n_matched": 1, "match_rate_pct": 33.33, "nota": "Match grueso por departamento+municipio+anio (sin 'sector': esa columna no sobrevive al esquema canonico de fct_contrato). Un match confirma solo que la misma geografia/anio tiene contratos en la muestra, no que sean el mismo hecho."}, "resumen": "AUC-ROC=0.3370 y lift@top-decil=0.000 sobre 50 contratos evaluados (4 positivos L1-L4) -- por debajo de las metas de PLAN.md (AUC>0.6, lift>1.5). Causa documentada en docs/METHODOLOGY.md 5.1: en esta muestra de un solo anio, casi todos los positivos disponibles son contratos SECOP I de un unico caso emblematico, sin los campos de proceso que activarian la mayoria de las banderas -- no es un problema de calibracion de pesos. De los 0 casos emblematicos con coincidencias genuinas en la muestra, 0 alcanzan el cuartil superior de riesgo de su propio anio."}, "artefactos": {"casos_prioritarios": {"top_n": 2500, "chunk_size": 500, "n_chunks": 1, "patron_archivo": "casos_prioritarios/{idx:03d}.json, idx = 000, 001, ... -- indice secuencial de 3 digitos, 500 filas por archivo salvo el ultimo (en esta corrida: 50 contratos en 1 archivo(s))"}, "contratos_recientes": {"top_n": 1000, "chunk_size": 500, "n_chunks": 1, "patron_archivo": "contratos_recientes/{idx:03d}.json, idx = 000, 001, ... -- ordenado por fecha_firma desc (no por score, ver METHODOLOGY.md 6.11), 500 filas por archivo salvo el ultimo (en esta corrida: 50 contratos en 1 archivo(s))"}, "entidades_top": {"top_n": 300, "criterio": "score desc (shrinkage empirico-bayesiano hacia el departamento, M5); empate: valor_total desc, nit_entidad_norm asc"}, "proveedores_top": {"top_n": 300, "criterio": "media de contrato_score.score ponderada por valor, shrunk empirico-bayesianamente hacia la media nacional (adaptacion M6 -- M5 no define un proveedor_score dedicado); e